{
  "schemaVersion": 1,
  "kind": "ModuleDocumentationIndexV1",
  "registryPath": "docs/system/truth/modules.v1.json",
  "specificationTemplate": "docs/modules/MODULE_TEMPLATE.md",
  "requiredSections": [
    "Identity",
    "Mission and non-goals",
    "Inputs and outputs",
    "State and authority",
    "Dependencies",
    "Concurrency and resources",
    "Determinism and optimization contract",
    "Failure, recovery, and idempotency",
    "Security and privacy",
    "Compatibility and migration",
    "SLO, capacity, and observability",
    "Operational runbook",
    "Verification and evidence",
    "Rollout and rollback",
    "Open blockers"
  ],
  "modules": {
    "module.author-node": {"specPath":"docs/modules/specs/author-node.md","manifestPath":"docs/modules/manifests/author-node.v1.json","documentationStatus":"complete"},
    "module.build-package": {"specPath":"docs/modules/specs/build-package.md","manifestPath":"docs/modules/manifests/build-package.v1.json","documentationStatus":"complete"},
    "module.candidate-router": {"specPath":"docs/modules/specs/candidate-router.md","manifestPath":"docs/modules/manifests/candidate-router.v1.json","documentationStatus":"complete"},
    "module.codex-broker": {"specPath":"docs/modules/specs/codex-broker.md","manifestPath":"docs/modules/manifests/codex-broker.v1.json","documentationStatus":"complete"},
    "module.commit-sequencer": {"specPath":"docs/modules/specs/commit-sequencer.md","manifestPath":"docs/modules/manifests/commit-sequencer.v1.json","documentationStatus":"complete"},
    "module.compatibility-kernel": {"specPath":"docs/modules/specs/compatibility-kernel.md","manifestPath":"docs/modules/manifests/compatibility-kernel.v1.json","documentationStatus":"complete"},
    "module.cutover-controller": {"specPath":"docs/modules/specs/cutover-controller.md","manifestPath":"docs/modules/manifests/cutover-controller.v1.json","documentationStatus":"complete"},
    "module.empirical-node": {"specPath":"docs/modules/specs/empirical-node.md","manifestPath":"docs/modules/manifests/empirical-node.v1.json","documentationStatus":"complete"},
    "module.execution-dispatcher": {"specPath":"docs/modules/specs/execution-dispatcher.md","manifestPath":"docs/modules/manifests/execution-dispatcher.v1.json","documentationStatus":"complete"},
    "module.external-authority-verifier": {"specPath":"docs/modules/specs/external-authority-verifier.md","manifestPath":"docs/modules/manifests/external-authority-verifier.v1.json","documentationStatus":"complete"},
    "module.formal-node": {"specPath":"docs/modules/specs/formal-node.md","manifestPath":"docs/modules/manifests/formal-node.v1.json","documentationStatus":"complete"},
    "module.module-registry": {"specPath":"docs/modules/specs/module-registry.md","manifestPath":"docs/modules/manifests/module-registry.v1.json","documentationStatus":"complete"},
    "module.node-control-plane": {"specPath":"docs/modules/specs/node-control-plane.md","manifestPath":"docs/modules/manifests/node-control-plane.v1.json","documentationStatus":"complete"},
    "module.node-legacy-adapter": {"specPath":"docs/modules/specs/node-legacy-adapter.md","manifestPath":"docs/modules/manifests/node-legacy-adapter.v1.json","documentationStatus":"complete"},
    "module.numerical-node": {"specPath":"docs/modules/specs/numerical-node.md","manifestPath":"docs/modules/manifests/numerical-node.v1.json","documentationStatus":"complete"},
    "module.observability": {"specPath":"docs/modules/specs/observability.md","manifestPath":"docs/modules/manifests/observability.v1.json","documentationStatus":"complete"},
    "module.performance-qualification": {"specPath":"docs/modules/specs/performance-qualification.md","manifestPath":"docs/modules/manifests/performance-qualification.v1.json","documentationStatus":"complete"},
    "module.policy-engine": {"specPath":"docs/modules/specs/policy-engine.md","manifestPath":"docs/modules/manifests/policy-engine.v1.json","documentationStatus":"complete"},
    "module.program-truth": {"specPath":"docs/modules/specs/program-truth.md","manifestPath":"docs/modules/manifests/program-truth.v1.json","documentationStatus":"complete"},
    "module.protocol-kernel": {"specPath":"docs/modules/specs/protocol-kernel.md","manifestPath":"docs/modules/manifests/protocol-kernel.v1.json","documentationStatus":"complete"},
    "module.qualification-ingest": {"specPath":"docs/modules/specs/qualification-ingest.md","manifestPath":"docs/modules/manifests/qualification-ingest.v1.json","documentationStatus":"complete"},
    "module.readonly-control": {"specPath":"docs/modules/specs/readonly-control.md","manifestPath":"docs/modules/manifests/readonly-control.v1.json","documentationStatus":"complete"},
    "module.resource-allocator": {"specPath":"docs/modules/specs/resource-allocator.md","manifestPath":"docs/modules/manifests/resource-allocator.v1.json","documentationStatus":"complete"},
    "module.reviewer-node": {"specPath":"docs/modules/specs/reviewer-node.md","manifestPath":"docs/modules/manifests/reviewer-node.v1.json","documentationStatus":"complete"},
    "module.rust-control-plane-service": {"specPath":"docs/modules/specs/rust-control-plane-service.md","manifestPath":"docs/modules/manifests/rust-control-plane-service.v1.json","documentationStatus":"complete"},
    "module.rust-local-vertical": {"specPath":"docs/modules/specs/rust-local-vertical.md","manifestPath":"docs/modules/manifests/rust-local-vertical.v1.json","documentationStatus":"complete"},
    "module.scheduler-core": {"specPath":"docs/modules/specs/scheduler-core.md","manifestPath":"docs/modules/manifests/scheduler-core.v1.json","documentationStatus":"complete"},
    "module.scientific-evidence": {"specPath":"docs/modules/specs/scientific-evidence.md","manifestPath":"docs/modules/manifests/scientific-evidence.v1.json","documentationStatus":"complete"},
    "module.snapshot-builder": {"specPath":"docs/modules/specs/snapshot-builder.md","manifestPath":"docs/modules/manifests/snapshot-builder.v1.json","documentationStatus":"complete"},
    "module.source-qualification": {"specPath":"docs/modules/specs/source-qualification.md","manifestPath":"docs/modules/manifests/source-qualification.v1.json","documentationStatus":"complete"},
    "module.submission-port": {"specPath":"docs/modules/specs/submission-port.md","manifestPath":"docs/modules/manifests/submission-port.v1.json","documentationStatus":"complete"},
    "module.workspace-authority": {"specPath":"docs/modules/specs/workspace-authority.md","manifestPath":"docs/modules/manifests/workspace-authority.v1.json","documentationStatus":"complete"}
  }
}
